{
  "isoWeek": "2026-W44",
  "startDate": "2026-10-26",
  "endDate": "2026-11-01",
  "windowStart": "2026-10-26",
  "windowEnd": "2026-10-26",
  "poolTotal": 2,
  "paperCount": 2,
  "curatedCount": 0,
  "sourceCount": 2,
  "selectionRule": "窗口内共 2 篇，按综合评分取前 2 篇（含全部 0 篇编辑精选），按时间倒序展示，不按评分排序。 本周尚未结束，数据仍在累积中。",
  "papers": [
    "2026-w44-01",
    "2026-w44-02"
  ]
}
